{"$schema":"https://json-schema.org/draft/2020-12/schema","$id":"https://example.invalid/gd-evaluation/schemas/deterministic-rule-result-v0.1.schema.json","title":"Deterministic Rule Result v0.1","type":"object","additionalProperties":false,"required":["contract_version","result_id","session_id","scenario_id","scenario_version","evaluator_version","rule_results"],"properties":{"contract_version":{"const":"0.1"},"result_id":{"type":"string","minLength":1},"session_id":{"type":"string","minLength":1},"scenario_id":{"type":"string","minLength":1},"scenario_version":{"type":"string","minLength":1},"evaluator_version":{"type":"string","minLength":1},"rule_results":{"type":"array","minItems":1,"items":{"type":"object","additionalProperties":false,"required":["rule_id","target","outcome","severity","evidence_message_ids","evidence_event_ids","affected_dimensions","detail"],"properties":{"rule_id":{"type":"string","minLength":1},"target":{"enum":["ai_system","episode","candidate"]},"outcome":{"enum":["pass","fail","not_applicable"]},"severity":{"enum":["info","minor","major","critical"]},"evidence_message_ids":{"type":"array","uniqueItems":true,"items":{"type":"string","minLength":1}},"evidence_event_ids":{"type":"array","uniqueItems":true,"items":{"type":"string","minLength":1}},"affected_dimensions":{"type":"array","uniqueItems":true,"items":{"enum":["issue_framing","logical_reasoning","listening_and_response","valuable_contribution","collaboration_and_relationship","decision_and_consensus","process_and_time_management"]}},"detail":{"type":"string","minLength":1}}}}}}
