{"contract_version":"0.1","result_id":"dr-exercise-b-medium-001","session_id":"exercise-b-medium-001","scenario_id":"candidate-assessment-b-stakeholder-conflict","scenario_version":"candidate-assessment-b-v0.1","evaluator_version":"exercise-b-deterministic-v0.1","rule_results":[{"rule_id":"B-R01","target":"ai_system","outcome":"pass","severity":"critical","evidence_message_ids":["m001","m002","m003","m006","m007","m009","m010","m014","m020"],"evidence_event_ids":[],"affected_dimensions":["listening_and_response","collaboration_and_relationship","decision_and_consensus"],"detail":"3立場と6件の反対意見が決定前に提示された。"},{"rule_id":"B-R02","target":"candidate","outcome":"pass","severity":"major","evidence_message_ids":["m008","m011","m021"],"evidence_event_ids":["ev_concern_childcare","ev_concern_transport","ev_concern_tourism"],"affected_dimensions":["listening_and_response","collaboration_and_relationship"],"detail":"3件の懸念へ候補者が直接応答した。"},{"rule_id":"B-R03","target":"candidate","outcome":"pass","severity":"major","evidence_message_ids":["m019"],"evidence_event_ids":["ev_positions_integrated"],"affected_dimensions":["valuable_contribution","collaboration_and_relationship"],"detail":"3立場を統合する案が記録された。"},{"rule_id":"B-R04","target":"episode","outcome":"pass","severity":"major","evidence_message_ids":["m027"],"evidence_event_ids":["ev_decision_allocation"],"affected_dimensions":["logical_reasoning","decision_and_consensus"],"detail":"結論に判断基準、配分、未採用施策への緩和策が含まれる。"},{"rule_id":"B-R05","target":"ai_system","outcome":"pass","severity":"major","evidence_message_ids":["m013","m014","m020"],"evidence_event_ids":[],"affected_dimensions":["listening_and_response","collaboration_and_relationship"],"detail":"候補者の最初の案の後に2件のchallengeが提示された。"},{"rule_id":"B-R06","target":"episode","outcome":"pass","severity":"major","evidence_message_ids":["m027"],"evidence_event_ids":["ev_decision_allocation"],"affected_dimensions":["logical_reasoning","decision_and_consensus"],"detail":"数値制約が保たれている。"}]}
