{"contract_version":"0.1","result_id":"dr-exercise-a-low-001","session_id":"exercise-a-low-001","scenario_id":"candidate-assessment-a-ambiguous-structure","scenario_version":"candidate-assessment-a-v0.1","evaluator_version":"exercise-a-deterministic-v0.1","rule_results":[{"rule_id":"A-R01","target":"ai_system","outcome":"pass","severity":"critical","evidence_message_ids":["m004","m006","m007"],"evidence_event_ids":[],"affected_dimensions":["issue_framing","valuable_contribution"],"detail":"AIが対象・基準を先に確定せず、利用者が先に定義した。"},{"rule_id":"A-R02","target":"episode","outcome":"fail","severity":"major","evidence_message_ids":["m006"],"evidence_event_ids":["ev_ctx_hours"],"affected_dimensions":["issue_framing","logical_reasoning"],"detail":"決定論的条件を満たさなかった。"},{"rule_id":"A-R03","target":"candidate","outcome":"fail","severity":"major","evidence_message_ids":["m007"],"evidence_event_ids":[],"affected_dimensions":["issue_framing","logical_reasoning"],"detail":"決定論的条件を満たさなかった。"},{"rule_id":"A-R04","target":"ai_system","outcome":"pass","severity":"major","evidence_message_ids":["m012","m015"],"evidence_event_ids":["ev_concern_noise","ev_concern_access"],"affected_dimensions":["listening_and_response","decision_and_consensus"],"detail":"非公開懸念は質問・比較後に開示された。"},{"rule_id":"A-R05","target":"episode","outcome":"fail","severity":"major","evidence_message_ids":[],"evidence_event_ids":[],"affected_dimensions":["decision_and_consensus","process_and_time_management"],"detail":"決定論的条件を満たさなかった。"}]}
