{
  "contract_version": "0.1",
  "evaluator_version": "exercise-b-deterministic-v0.1",
  "result_id": "dr-exercise-b-low-001",
  "rule_results": [
    {
      "affected_dimensions": [
        "listening_and_response",
        "collaboration_and_relationship",
        "decision_and_consensus"
      ],
      "detail": "3立場と6件の反対意見が決定前に提示された。",
      "evidence_event_ids": [],
      "evidence_message_ids": [
        "m001",
        "m002",
        "m003",
        "m006",
        "m007",
        "m009",
        "m010",
        "m014",
        "m020"
      ],
      "outcome": "pass",
      "rule_id": "B-R01",
      "severity": "critical",
      "target": "ai_system"
    },
    {
      "affected_dimensions": [
        "listening_and_response",
        "collaboration_and_relationship"
      ],
      "detail": "決定論的条件を満たさなかった。",
      "evidence_event_ids": [],
      "evidence_message_ids": [],
      "outcome": "fail",
      "rule_id": "B-R02",
      "severity": "major",
      "target": "candidate"
    },
    {
      "affected_dimensions": [
        "valuable_contribution",
        "collaboration_and_relationship"
      ],
      "detail": "決定論的条件を満たさなかった。",
      "evidence_event_ids": [],
      "evidence_message_ids": [],
      "outcome": "fail",
      "rule_id": "B-R03",
      "severity": "major",
      "target": "candidate"
    },
    {
      "affected_dimensions": [
        "logical_reasoning",
        "decision_and_consensus"
      ],
      "detail": "決定論的条件を満たさなかった。",
      "evidence_event_ids": [],
      "evidence_message_ids": [],
      "outcome": "fail",
      "rule_id": "B-R04",
      "severity": "major",
      "target": "episode"
    },
    {
      "affected_dimensions": [
        "listening_and_response",
        "collaboration_and_relationship"
      ],
      "detail": "候補者の最初の案の後に2件のchallengeが提示された。",
      "evidence_event_ids": [],
      "evidence_message_ids": [
        "m013",
        "m014",
        "m020"
      ],
      "outcome": "pass",
      "rule_id": "B-R05",
      "severity": "major",
      "target": "ai_system"
    },
    {
      "affected_dimensions": [
        "logical_reasoning",
        "decision_and_consensus"
      ],
      "detail": "数値制約が保たれている。",
      "evidence_event_ids": [
        "ev_decision_allocation"
      ],
      "evidence_message_ids": [
        "m027"
      ],
      "outcome": "pass",
      "rule_id": "B-R06",
      "severity": "major",
      "target": "episode"
    }
  ],
  "scenario_id": "candidate-assessment-b-stakeholder-conflict",
  "scenario_version": "candidate-assessment-b-v0.1",
  "session_id": "exercise-b-low-001"
}
